{
  "version": "0.0.0-dev.0",
  "build_ts": "2025-12-25T10:09:54.142Z",
  "checkId": "A004",
  "checkTitle": "Cluster information",
  "timestamptz": "2025-12-25T10:11:12.560Z",
  "nodes": {
    "primary": "node-01",
    "standbys": []
  },
  "results": {
    "node-01": {
      "data": {
        "general_info": {
          "total_connections": {
            "value": "13",
            "unit": "connections",
            "description": "Total active database connections"
          },
          "total_commits": {
            "value": "67456944",
            "unit": "transactions",
            "description": "Total committed transactions"
          },
          "total_rollbacks": {
            "value": "1053",
            "unit": "transactions",
            "description": "Total rolled back transactions"
          },
          "cache_hit_ratio": {
            "value": "99.98",
            "unit": "%",
            "description": "Buffer cache hit ratio"
          },
          "blocks_read": {
            "value": "26036165",
            "unit": "blocks",
            "description": "Total disk blocks read"
          },
          "blocks_hit": {
            "value": "118453546175",
            "unit": "blocks",
            "description": "Total buffer cache hits"
          },
          "tuples_returned": {
            "value": "29618940903",
            "unit": "rows",
            "description": "Total rows returned by queries"
          },
          "tuples_fetched": {
            "value": "5134662994",
            "unit": "rows",
            "description": "Total rows fetched by queries"
          },
          "tuples_inserted": {
            "value": "5738899",
            "unit": "rows",
            "description": "Total rows inserted"
          },
          "tuples_updated": {
            "value": "4803567236",
            "unit": "rows",
            "description": "Total rows updated"
          },
          "tuples_deleted": {
            "value": "3260771",
            "unit": "rows",
            "description": "Total rows deleted"
          },
          "total_deadlocks": {
            "value": "0",
            "unit": "deadlocks",
            "description": "Total deadlocks detected"
          },
          "temp_files_created": {
            "value": "37554",
            "unit": "files",
            "description": "Total temporary files created"
          },
          "temp_bytes_written": {
            "value": "197.32 GB",
            "unit": "bytes",
            "description": "Total temporary file bytes written"
          },
          "connections_null": {
            "value": "8",
            "unit": "connections",
            "description": "Connections in 'null' state"
          },
          "connections_active": {
            "value": "3",
            "unit": "connections",
            "description": "Connections in 'active' state"
          },
          "connections_idle": {
            "value": "9",
            "unit": "connections",
            "description": "Connections in 'idle' state"
          },
          "start_time": {
            "value": "2025-11-12T16:19:56.389Z",
            "unit": "timestamp",
            "description": "PostgreSQL server start time"
          },
          "uptime": {
            "value": {
              "days": 42,
              "hours": 17,
              "minutes": 51,
              "seconds": 16,
              "milliseconds": 994.388
            },
            "unit": "interval",
            "description": "Server uptime"
          }
        },
        "database_sizes": {
          "goodvibes_db1": 37955226771,
          "postgres": 709037203,
          "index_pilot_control": 13970579,
          "rdsadmin": 7701007,
          "azure_maintenance": 7701007,
          "cloudsqladmin": 7701007
        }
      },
      "postgres_version": {
        "version": "17.6 (Ubuntu 17.6-2.pgdg22.04+1)",
        "server_version_num": "170006",
        "server_major_ver": "17",
        "server_minor_ver": "6"
      }
    }
  }
}